{
  "schemaVersion": 1,
  "id": "en-ru",
  "targetLanguage": "en",
  "nativeLanguage": "ru",
  "title": "Английский для русскоязычных",
  "training": {
    "chainPresentation": {
      "steps": [
        {
          "id": "obj",
          "label": "Вижу"
        },
        {
          "id": "past",
          "label": "Прошлое"
        },
        {
          "id": "neg",
          "label": "Отрицание"
        },
        {
          "id": "owner",
          "label": "Владелец"
        },
        {
          "id": "loc",
          "label": "Место"
        }
      ],
      "completion": {
        "title": "Цепочка завершена",
        "reactEyebrow": "5 преобразований",
        "reactBody": "Ты изменил время, отрицание, владельца и роль дополнения, сохранив одну мысль. Оценки сохранены в расписании повторений.",
        "webBody": "Пять преобразований завершены. Оценки сохранены в расписании повторений."
      }
    }
  },
  "reference": {},
  "skills": [
    {
      "id": "en:role.object",
      "title": "Object · без падежа",
      "group": "Roles",
      "level": "A1",
      "formula": "Подлежащее → дополнение: падежа нет, меняется только порядок слов (Subject-Verb-Object).",
      "theory": "В английском у существительных нет падежных окончаний: форма слова одна и та же и для подлежащего, и для дополнения. Роль слова показывает порядок: I see my house — «house» дополнение просто потому, что стоит после глагола.",
      "hint": "my beautiful house → I see my beautiful house.",
      "prerequisites": [],
      "focus": {
        "before": "my beautiful house",
        "after": "my beautiful house"
      },
      "methods": {
        "logic": {
          "introduction": "В английском у существительных нет падежных окончаний: форма слова одна и та же и для подлежащего, и для дополнения. Роль слова показывает порядок: I see my house — «house» дополнение просто потому, что стоит после глагола.",
          "promptLead": "Сначала определи правило и форму.",
          "introduce": "Проверь: меняется ли форма существительного при переходе из подлежащего в дополнение?",
          "retrieve": "Определи признаки и преобразуй исходное предложение самостоятельно.",
          "feedback": "Сравни исходную и новую форму, затем проверь каждое изменение и правило.",
          "review": "Выбери «Повторить» или «Вспомнил» по своей попытке; затем реши новое задание без подсказки."
        },
        "situations": {
          "introduction": "Ты показываешь собеседнику предмет, о котором говоришь. В английском не нужно менять форму слова — только сказать её после «I see».",
          "promptLead": "Представь ситуацию и скажи целое предложение.",
          "introduce": "Ты сообщаешь собеседнику, что видишь названное. Как сказать об этом целой фразой?",
          "retrieve": "Представь ситуацию и скажи целое предложение самостоятельно.",
          "feedback": "Сравни, что хотел сказать, с эталоном: форма слова не меняется, меняется только его место в предложении.",
          "review": "Оцени, удалось ли вспомнить ответ самостоятельно; следующую ситуацию реши заново."
        }
      },
      "styleContent": {
        "nativeParallel": [
          {
            "native": "Вижу дом.",
            "target": "I see a house.",
            "matches": false,
            "note": "В русском нет артикля вообще — «дом» без «a»/«the» звучит нормально; в английском голое существительное почти всегда требует артикль. Это первое расхождение, которое собьёт русскоговорящего чаще всего."
          }
        ],
        "examples": [
          "I see a book.",
          "I see a dog."
        ],
        "why": "Английский обозначает роль слова местом в предложении, а не окончанием — поэтому дополнение выглядит точно так же, как подлежащее, просто стоит после глагола."
      }
    },
    {
      "id": "en:verb.presentSimple",
      "title": "Present Simple",
      "group": "Verb",
      "level": "A1",
      "formula": "3-е лицо ед.ч.: добавляем -s/-es к базовой форме глагола (Past → Pres).",
      "theory": "В настоящем простом времени для he/she/it к глаголу добавляется -s (walk → walks). Это единственное изменение формы глагола по лицу для этого времени.",
      "hint": "walked → walks",
      "prerequisites": [],
      "focus": {
        "before": "walked",
        "after": "walks"
      },
      "methods": {
        "logic": {
          "introduction": "В настоящем простом времени для he/she/it к глаголу добавляется -s (walk → walks). Это единственное изменение формы глагола по лицу для этого времени.",
          "promptLead": "Сначала определи правило и форму.",
          "introduce": "Проверь: это 3-е лицо единственного числа? Тогда добавь -s к базовой форме.",
          "retrieve": "Определи признаки и преобразуй исходное предложение самостоятельно.",
          "feedback": "Сравни исходную и новую форму, затем проверь каждое изменение и правило.",
          "review": "Выбери «Повторить» или «Вспомнил» по своей попытке; затем реши новое задание без подсказки."
        },
        "situations": {
          "introduction": "Ты рассказываешь о привычном действии — том, что происходит регулярно, не именно сейчас.",
          "promptLead": "Представь ситуацию и скажи целое предложение.",
          "introduce": "Как сказать, что это происходит обычно, а не сейчас?",
          "retrieve": "Представь ситуацию и скажи целое предложение самостоятельно.",
          "feedback": "Сравни свой ответ с эталоном: обрати внимание на окончание -s.",
          "review": "Оцени, удалось ли вспомнить ответ самостоятельно; следующую ситуацию реши заново."
        }
      },
      "styleContent": {
        "nativeParallel": [
          {
            "native": "Он читает книгу каждый день.",
            "target": "He reads a book every day.",
            "matches": false,
            "note": "В русском лицо глагола различается на каждой форме (читаю/читаешь/читает/читаем/читаете/читают) — окончание меняется всегда. В английском наоборот: единственный маркер лица во всём наборе — окончание -s, и только для he/she/it; I/you/we/they вообще без окончания. Из-за этого русскоговорящие либо забывают -s там, где оно обязательно, либо по инерции добавляют его туда, где оно не нужно."
          }
        ],
        "examples": [
          "The dog walks.",
          "She reads a book."
        ],
        "why": "Present Simple обозначает привычные, регулярные действия и факты; -s в 3-м лице — единственный маркер лица в этом времени."
      }
    },
    {
      "id": "en:possessive.my",
      "title": "My, his, her, our...",
      "group": "Agreement",
      "level": "A1",
      "formula": "Притяжательное местоимение не согласуется ни с родом, ни с числом предмета: my/your/his/her/its/our/their — всегда одна форма.",
      "theory": "В отличие от русского («мой/моя/моё»), английское притяжательное местоимение не изменяется по роду или числу владения: my dog, my house, my houses — форма my одна на все случаи.",
      "hint": "my beautiful house → her beautiful house",
      "prerequisites": [
        "en:role.object"
      ],
      "focus": {
        "before": "my beautiful house",
        "after": "her beautiful house"
      },
      "methods": {
        "logic": {
          "introduction": "В отличие от русского («мой/моя/моё»), английское притяжательное местоимение не изменяется по роду или числу владения: my dog, my house, my houses — форма my одна на все случаи.",
          "promptLead": "Сначала определи правило и форму.",
          "introduce": "Проверь: меняется ли форма прилагательного или существительного при замене владельца? Нет — меняется только само местоимение.",
          "retrieve": "Определи признаки и преобразуй исходное предложение самостоятельно.",
          "feedback": "Сравни исходную и новую форму, затем проверь каждое изменение и правило.",
          "review": "Выбери «Повторить» или «Вспомнил» по своей попытке; затем реши новое задание без подсказки."
        },
        "situations": {
          "introduction": "Ты говоришь о предмете, который принадлежит кому-то другому — не тебе.",
          "promptLead": "Представь ситуацию и скажи целое предложение.",
          "introduce": "Как сказать, что этот предмет принадлежит другому человеку?",
          "retrieve": "Представь ситуацию и скажи целое предложение самостоятельно.",
          "feedback": "Сравни ответ с эталоном: остальная фраза не меняется, меняется только владелец.",
          "review": "Оцени, удалось ли вспомнить ответ самостоятельно; следующую ситуацию реши заново."
        }
      },
      "styleContent": {
        "nativeParallel": [
          {
            "native": "Моя книга.",
            "target": "My book.",
            "matches": true,
            "note": "Порядок владелец-перед-существительным совпадает в обоих языках, притяжательное не согласуется по числу/роду ни там, ни там на уровне «мой/my» — единственный skill из 16, где английское явление проще русского, не только польского."
          }
        ],
        "examples": [
          "This is her book.",
          "This is their car."
        ],
        "why": "Английское притяжательное — закрытый список неизменяемых слов; в отличие от польского и русского, ему не нужно согласование с родом или числом существительного."
      }
    },
    {
      "id": "en:mood.question",
      "title": "Yes/No Question · do-support",
      "group": "Sentence",
      "level": "A1",
      "formula": "Вопрос образуется через вынесенный вперёд вспомогательный do/does, а не порядком слов.",
      "theory": "В отличие от русского, где вопрос — это только интонация, английский вопрос требует вспомогательный глагол do/does, поставленный перед подлежащим: You walk. → Do you walk?",
      "hint": "You walk. → Do you walk?",
      "prerequisites": [
        "en:verb.presentSimple"
      ],
      "focus": {
        "before": "You walk.",
        "after": "Do you walk?"
      },
      "methods": {
        "logic": {